{
  "previewInstruction": "<p><b>Translate the word problem into an equation.</b></p><p>Each round has 3 small steps:</p><ol style=\"padding-left: 20px;\"><li>Pick the person you want to call <b>x</b>.</li><li>Write the other person's age.</li><li>Write the equation.</li></ol><p><b>Hard mode:</b> bigger numbers and more two-people-with-time-shift problems. Wrong taps just give you a hint &mdash; <b>no lives lost</b>. Three stars for getting most steps right on the first try.</p>",
  "previewAudioText": "Translate each word problem into an equation in three small steps. Pick a variable, write the other age, write the equation. Hard mode brings bigger numbers and more time-shift problems. Wrong taps just give you a hint, no lives lost.",
  "previewAudio": null,
  "showGameOnPreview": false,
  "totalRounds": 10,
  "totalLives": 10,
  "timer": false,
  "answerComponent": true,
  "rounds": [
    {
      "set": "A",
      "id": "A_r1_aman_past_easy_hard",
      "round": 1,
      "stage": 1,
      "type": "A",
      "problemText": "<p>7 years ago, Aman was 14. How old is Aman now?</p>",
      "problemAudioText": "7 years ago, Aman was 14. How old is Aman now?",
      "people": [
        {
          "name": "Aman"
        }
      ],
      "timeDelta": -7,
      "preferredVariable": "Aman",
      "step2": {
        "kind": "directionTiles",
        "tiles": [
          {
            "label": "x − 7",
            "correct": true,
            "misconception": null
          },
          {
            "label": "x + 7",
            "correct": false,
            "misconception": "time-shift-direction-flip"
          }
        ]
      },
      "step3": {
        "slotTemplate": [
          "__slot__",
          "__slot__",
          "__slot__",
          "__slot__",
          "__slot__"
        ],
        "pieceBank": [
          "x",
          "−",
          "+",
          7,
          "=",
          14,
          19
        ],
        "correctPieces": [
          "x",
          "−",
          7,
          "=",
          14
        ],
        "pieceMisconceptions": {
          "19": "distractor-number-confusion",
          "+": "time-shift-direction-flip"
        }
      },
      "solution": {
        "variableValue": 21,
        "solveLines": [
          "x − 7 = 14",
          "x = 21"
        ],
        "captionedAnswers": [
          {
            "name": "Aman (now)",
            "value": 21
          }
        ],
        "successSubtitle": "Aman is 21 now.",
        "successAudio": "Aman is 21 now."
      },
      "answer": {
        "problemText": "<p>7 years ago, Aman was 14. How old is Aman now?</p>",
        "canonicalEquationDisplay": "x − 7 = 14",
        "solveLines": [
          "x − 7 = 14",
          "x = 21"
        ],
        "captionedAnswers": [
          {
            "name": "Aman",
            "value": 21
          }
        ],
        "explanation": "\"7 years ago\" subtracts 7 from x. So x − 7 = 14 gives x = 21."
      }
    },
    {
      "set": "A",
      "id": "A_r2_sara_future_easy_hard",
      "round": 2,
      "stage": 1,
      "type": "A",
      "problemText": "<p>Sara is 12 now. How old will Sara be in 6 years?</p>",
      "problemAudioText": "Sara is 12 now. How old will Sara be in 6 years?",
      "people": [
        {
          "name": "Sara"
        }
      ],
      "timeDelta": 6,
      "preferredVariable": "Sara",
      "step2": {
        "kind": "directionTiles",
        "tiles": [
          {
            "label": "x + 6",
            "correct": true,
            "misconception": null
          },
          {
            "label": "x − 6",
            "correct": false,
            "misconception": "time-shift-direction-flip"
          }
        ]
      },
      "step3": {
        "slotTemplate": [
          "__slot__",
          "__slot__",
          "__slot__",
          "__slot__",
          "__slot__"
        ],
        "pieceBank": [
          "x",
          "+",
          "−",
          6,
          12,
          "=",
          18
        ],
        "correctPieces": [
          "x",
          "+",
          6,
          "=",
          18
        ],
        "pieceMisconceptions": {
          "12": "distractor-number-confusion",
          "−": "time-shift-direction-flip"
        }
      },
      "solution": {
        "variableValue": 12,
        "solveLines": [
          "x = 12",
          "x + 6 = 18"
        ],
        "captionedAnswers": [
          {
            "name": "Sara (now)",
            "value": 12
          },
          {
            "name": "Sara (in 6 yr)",
            "value": 18
          }
        ],
        "successSubtitle": "Sara is 12 now, and 18 in 6 years.",
        "successAudio": "Sara is 12 now, and 18 in 6 years."
      },
      "answer": {
        "problemText": "<p>Sara is 12 now. How old in 6 years?</p>",
        "canonicalEquationDisplay": "x + 6 = 18",
        "solveLines": [
          "x = 12",
          "x + 6 = 18"
        ],
        "captionedAnswers": [
          {
            "name": "Sara",
            "value": 12
          },
          {
            "name": "in 6 yr",
            "value": 18
          }
        ],
        "explanation": "Sara is x = 12; in 6 years he/she is 18."
      }
    },
    {
      "set": "A",
      "id": "A_r3_mira_ravi_easy_hard",
      "round": 3,
      "stage": 2,
      "type": "B",
      "problemText": "<p>Mira is 7 years younger than Ravi. Their ages sum to 31. How old is Mira?</p>",
      "problemAudioText": "Mira is 7 years younger than Ravi. Their ages sum to 31. How old is Mira?",
      "people": [
        {
          "name": "Mira"
        },
        {
          "name": "Ravi"
        }
      ],
      "timeDelta": null,
      "preferredVariable": "Mira",
      "step2": {
        "kind": "pieceBank",
        "slotTemplate": [
          "x",
          "__slot__",
          "__slot__"
        ],
        "pieceBank": [
          "+",
          "−",
          7,
          31,
          8
        ],
        "correctPieces": [
          "+",
          7
        ],
        "pieceMisconceptions": {
          "8": "distractor-number-confusion",
          "31": "distractor-number-confusion",
          "−": "sign-error-younger-confused-with-older"
        }
      },
      "step3": {
        "slotTemplate": [
          "x",
          "+",
          "__slot__",
          "__slot__",
          "__slot__",
          "=",
          "31"
        ],
        "pieceBank": [
          "x",
          "+",
          "−",
          "·",
          7,
          31,
          24,
          "="
        ],
        "correctPieces": [
          "x",
          "+",
          7
        ],
        "pieceMisconceptions": {
          "24": "distractor-number-confusion",
          "−": "operation-mismatch",
          "·": "operation-mismatch"
        }
      },
      "solution": {
        "variableValue": 12,
        "solveLines": [
          "x + (x + 7) = 31",
          "2x + 7 = 31",
          "x = 12"
        ],
        "captionedAnswers": [
          {
            "name": "Mira",
            "value": 12
          },
          {
            "name": "Ravi",
            "value": 19
          }
        ],
        "successSubtitle": "Mira is 12 and Ravi is 19.",
        "successAudio": "Mira is 12 and Ravi is 19."
      },
      "answer": {
        "problemText": "<p>Mira is 7 years younger than Ravi. Sum 31.</p>",
        "canonicalEquationDisplay": "x + (x + 7) = 31",
        "solveLines": [
          "x + (x + 7) = 31",
          "2x = 24",
          "x = 12"
        ],
        "captionedAnswers": [
          {
            "name": "Mira",
            "value": 12
          },
          {
            "name": "Ravi",
            "value": 19
          }
        ],
        "explanation": "Mira (younger) is x, Ravi is x + 7. Sum 31 gives x = 12."
      }
    },
    {
      "set": "A",
      "id": "A_r4_bobby_anita_easy_hard",
      "round": 4,
      "stage": 2,
      "type": "B",
      "problemText": "<p>Bobby is 9 years younger than Anita. Their ages sum to 35. How old is Bobby?</p>",
      "problemAudioText": "Bobby is 9 years younger than Anita. Their ages sum to 35. How old is Bobby?",
      "people": [
        {
          "name": "Bobby"
        },
        {
          "name": "Anita"
        }
      ],
      "timeDelta": null,
      "preferredVariable": "Bobby",
      "step2": {
        "kind": "pieceBank",
        "slotTemplate": [
          "x",
          "__slot__",
          "__slot__"
        ],
        "pieceBank": [
          "+",
          "−",
          9,
          35,
          10
        ],
        "correctPieces": [
          "+",
          9
        ],
        "pieceMisconceptions": {
          "10": "distractor-number-confusion",
          "35": "distractor-number-confusion",
          "−": "sign-error-younger-confused-with-older"
        }
      },
      "step3": {
        "slotTemplate": [
          "x",
          "+",
          "__slot__",
          "__slot__",
          "__slot__",
          "=",
          "35"
        ],
        "pieceBank": [
          "x",
          "+",
          "−",
          "·",
          9,
          35,
          26,
          "="
        ],
        "correctPieces": [
          "x",
          "+",
          9
        ],
        "pieceMisconceptions": {
          "26": "distractor-number-confusion",
          "−": "operation-mismatch",
          "·": "operation-mismatch"
        }
      },
      "solution": {
        "variableValue": 13,
        "solveLines": [
          "x + (x + 9) = 35",
          "2x + 9 = 35",
          "x = 13"
        ],
        "captionedAnswers": [
          {
            "name": "Bobby",
            "value": 13
          },
          {
            "name": "Anita",
            "value": 22
          }
        ],
        "successSubtitle": "Bobby is 13 and Anita is 22.",
        "successAudio": "Bobby is 13 and Anita is 22."
      },
      "answer": {